<?xml version="1.0"?>
<!DOCTYPE catalog PUBLIC "-//JSky//DTD for Catalog Access//EN" "AstroCat.dtd">
<!--
  This document describes the query arguments and access method for an astronomical catalog.
-->


 <catalog 
   id="2MASSImg@OASIS" 
   name="2MASS Quick-Look Image Retrieval Service" 
   description="Accessed via the NASA/IPAC Infrared Science Archive"
   type="imagesvr"
   protocol="http"
   host="irsa.ipac.caltech.edu"
   path="/cgi-bin/Oasis/2MASSImg/nph-2massimg">
   <params>
     <param 
       id="objstr" 
       name="Object or location"
       description="Object name or coordinate string (fairly free-form)."
       type="radec"/>
     <param 
       id="size" 
       name="Size"
       units="arcsec"
       description="Cropped image size"
       type="size"/>
     <param 
       id="band" 
       name="Band"
       description="2MASS band (J, H, or K)"
       value="J">
       <options>
         <option name="J" value="J"/>
         <option name="H" value="H"/>
         <option name="K" value="K"/>
       </options>
     </param>
   </params>
 </catalog>

